{
    "__COUNTRY_NAME__": "Mauritius",
    "__COUNTRY_A2__": "MU",
    "__COUNTRY_A3__": "MUS",
    "__COUNTRY_N3__": "480",
    "__LANGUAGE_A2__": "en",
    "__LANGUAGES_A2__": [
        "en",
        "fr"
    ],
    "address": {
        "input_layout": [
            "level1area",
            "settlement",
            "postcode",
            "street"
        ],
        "output_format": "{% if has_recipient %}{{ recipient_text }}\n{% endif %}{% if has_street %}{{ street_text }}\n{% endif %}{% if has_settlement or has_postcode %}{% if has_settlement %}{{ settlement_text }}{% if has_postcode %} {% endif %}{% endif %}{% if has_postcode %}{{ postcode_text }}{% endif %}\n{% endif %}{% if has_level1area %}{{ level1area_name }}\n{% endif %}{% if has_country %}{{ country_name }}\n{% endif %}",
        "level1area_names": {
            "en": "District"
        },
        "level2area_names": null,
        "settlement_names": {
            "en": "Settlement"
        },
        "postcode_names": {
            "en": "Post Code"
        },
        "postcode_input_pattern": "[0-9]{5}",
        "postcode_input_example": "12345",
        "street_names": {
            "en": "House number, road"
        }
    },
    "phone": {
        "names": {
            "en": "Phone Number"
        },
        "prefixes": [
            "230"
        ],
        "input_pattern": "[0-9]+",
        "input_example": "####",
        "output_format": {
            "\\A.*\\Z": "\\1"
        }
    },
    "organization_id": null,
    "person_id": null,
    "iban": {
        "names": {
            "en": "IBAN"
        },
        "input_pattern": "MU[0-9]{2}[A-Z]{4}[0-9]{19}[A-Z]{3}",
        "input_example": "MU12ABCD1234567890123456789ABC",
        "output_format": {
            "\\A.*\\Z": "\\1"
        }
    }
}