{
    "__COUNTRY_NAME__": "Serbia",
    "__COUNTRY_A2__": "RS",
    "__COUNTRY_A3__": "SRB",
    "__COUNTRY_N3__": "688",
    "__LANGUAGE_A2__": "sr",
    "__LANGUAGES_A2__": [
        "sr",
        "sr-latn",
        "hu",
        "ro",
        "hr",
        "sk",
        "uk"
    ],
    "address": {
        "input_layout": [
            "level1area",
            "level2area",
            "settlement",
            "postcode",
            "street"
        ],
        "output_format": "{% if has_recipient %}{{ recipient_text }}\n{% endif %}{% if has_street %}{{ street_text }}\n{% endif %}{% if has_postcode or has_settlement %}{% if has_postcode %}{{ postcode_text }}{% if has_settlement %} {% endif %}{% endif %}{% if has_settlement %}{{ settlement_text }}{% endif %}\n{% endif %}{% if has_level1area or has_level2area %}{% if has_level1area %}{{ level1area_name }}{% if has_level2area %} {% endif %}{% endif %}{% if has_level2area %}{{ level2area_name }}{% endif %}\n{% endif %}{% if has_country %}{{ country_name }}\n{% endif %}",
        "level1area_names": {
            "en": "District"
        },
        "level2area_names": {
            "en": "Municipality"
        },
        "settlement_names": {
            "en": "Settlement"
        },
        "postcode_names": {
            "en": "Post Code"
        },
        "postcode_input_pattern": "[0-9]{5}",
        "postcode_input_example": "12345",
        "street_names": {
            "en": "Road, house number"
        }
    },
    "phone": {
        "names": {
            "en": "Phone Number"
        },
        "prefixes": [
            "381"
        ],
        "input_pattern": "[0-9]+",
        "input_example": "####",
        "output_format": {
            "\\A.*\\Z": "\\1"
        }
    },
    "organization_id": {
        "names": {
            "en": "Tax Identification Number",
            "sr": "Poreski identifikacioni broj"
        },
        "abbreviations": {
            "en": "TIN",
            "sr": "PIB"
        },
        "input_pattern": "[0-9]{9}",
        "input_example": "123456789",
        "output_format": {
            "\\A.*\\Z": "\\1"
        }
    },
    "person_id": null,
    "iban": {
        "names": {
            "en": "IBAN"
        },
        "input_pattern": "RS[0-9]{20}",
        "input_example": "RS12345678901234567890",
        "output_format": {
            "\\A.*\\Z": "\\1"
        }
    }
}