{
    "__COUNTRY_NAME__": "Norway",
    "__COUNTRY_A2__": "NO",
    "__COUNTRY_A3__": "NOR",
    "__COUNTRY_N3__": "578",
    "__LANGUAGE_A2__": "nb",
    "__LANGUAGES_A2__": [
        "nb",
        "no",
        "nn",
        "se"
    ],
    "address": {
        "input_layout": [
            "level1area",
            "postcode",
            "settlement",
            "street"
        ],
        "output_format": "{% if has_recipient %}{{ recipient_text }}\n{% endif %}{% if has_street %}{{ street_text }}\n{% endif %}{% if has_postcode or has_settlement %}{% if has_postcode %}{{ postcode_text }}{% if has_settlement %} {% endif %}{% endif %}{% if has_settlement %}{{ settlement_text }}{% endif %}\n{% endif %}{% if has_level1area %}{{ level1area_name }}\n{% endif %}{% if has_country %}{{ country_name }}\n{% endif %}",
        "level1area_names": {
            "en": "County"
        },
        "level2area_names": null,
        "settlement_names": {
            "en": "Settlement"
        },
        "postcode_names": {
            "en": "Post Code"
        },
        "postcode_input_pattern": "[0-9]{4}",
        "postcode_input_example": "1234",
        "street_names": {
            "en": "Road, house number"
        }
    },
    "phone": {
        "names": {
            "en": "Phone Number"
        },
        "prefixes": [
            "47"
        ],
        "input_pattern": "[0-9]+",
        "input_example": "####",
        "output_format": {
            "\\A.*\\Z": "\\1"
        }
    },
    "organization_id": {
        "names": {
            "en": "Organization number",
            "nb": "Organisasjonsnummer",
            "nn": "Organisasjonsnummer"
        },
        "abbreviations": {
            "en": "Org No.",
            "nb": "Orgnr",
            "nn": "Orgnr"
        },
        "input_pattern": "[0-9]{9}MVA",
        "input_example": "123456789MVA",
        "output_format": {
            "\\A.*\\Z": "\\1"
        }
    },
    "person_id": null,
    "iban": {
        "names": {
            "en": "IBAN"
        },
        "input_pattern": "NO[0-9]{13}",
        "input_example": "NO1234567890123",
        "output_format": {
            "\\A.*\\Z": "\\1"
        }
    }
}