{
    "__COUNTRY_NAME__": "Myanmar (Burma)",
    "__COUNTRY_A2__": "MM",
    "__COUNTRY_A3__": "MMR",
    "__COUNTRY_N3__": "104",
    "__LANGUAGE_A2__": "my",
    "__LANGUAGES_A2__": [
        "my"
    ],
    "address": {
        "input_layout": [
            "level1area",
            "postcode",
            "settlement",
            "street"
        ],
        "output_format": "{% if has_recipient %}{{ recipient_text }}\n{% endif %}{% if has_street %}{{ street_text }}\n{% endif %}{% if has_settlement or has_postcode %}{% if has_settlement %}{{ settlement_text }}{% if has_postcode %}, {% endif %}{% endif %}{% if has_postcode %}{{ postcode_text }}{% endif %}\n{% endif %}{% if has_level1area %}{{ level1area_name }}{% endif %}{% if has_country %}{{ country_name }}\n{% endif %}",
        "level1area_names": {
            "en": "State / Region / Zone"
        },
        "level2area_names": null,
        "settlement_names": {
            "en": "Settlement"
        },
        "postcode_names": {
            "en": "Post Code"
        },
        "postcode_input_pattern": "[0-9]{5}",
        "postcode_input_example": "12345",
        "street_names": {
            "en": "House number, road"
        }
    },
    "phone": {
        "names": {
            "en": "Phone Number"
        },
        "prefixes": [
            "95"
        ],
        "input_pattern": "[0-9]+",
        "input_example": "####",
        "output_format": {
            "\\A.*\\Z": "\\1"
        }
    },
    "organization_id": null,
    "person_id": null,
    "iban": null
}