{
    "__COUNTRY_NAME__": "Peru",
    "__COUNTRY_A2__": "PE",
    "__COUNTRY_A3__": "PER",
    "__COUNTRY_N3__": "604",
    "__LANGUAGE_A2__": "es",
    "__LANGUAGES_A2__": [
        "es",
        "qu"
    ],
    "address": {
        "input_layout": [
            "level1area",
            "settlement",
            "postcode",
            "street"
        ],
        "output_format": "{% if has_recipient %}{{ recipient_text }}\n{% endif %}{% if has_street %}{{ street_text }}\n{% endif %}{% if has_settlement or has_postcode %}{% if has_settlement %}{{ settlement_text }}{% if has_postcode %} {% endif %}{% endif %}{% if has_postcode %}{{ postcode_text }}{% endif %}\n{% endif %}{% if has_level1area %}{{ level1area_name }}\n{% endif %}{% if has_country %}{{ country_name }}\n{% endif %}",
        "level1area_names": {
            "en": "Regional Governments"
        },
        "level2area_names": null,
        "settlement_names": {
            "en": "Settlement"
        },
        "postcode_names": {
            "en": "Post Code"
        },
        "postcode_input_pattern": "(PE[0-9]{4})|[0-9]{5}",
        "postcode_input_example": "PE1234",
        "street_names": {
            "en": "Road, house number, district"
        }
    },
    "phone": {
        "names": {
            "en": "Phone Number"
        },
        "prefixes": [
            "51"
        ],
        "input_pattern": "[0-9]+",
        "input_example": "####",
        "output_format": {
            "\\A.*\\Z": "\\1"
        }
    },
    "organization_id": {
        "names": {
            "en": "Single Registry of Taxpayers",
            "es": "Registro Unico de Contribuyentes"
        },
        "abbreviations": {
            "en": "SRT",
            "es": "RUC"
        },
        "input_pattern": "[0-9]{11}",
        "input_example": "12345678901",
        "output_format": {
            "\\A.*\\Z": "\\1"
        }
    },
    "person_id": null,
    "iban": null
}