{
    "__COUNTRY_NAME__": "Algeria",
    "__COUNTRY_A2__": "DZ",
    "__COUNTRY_A3__": "DZA",
    "__COUNTRY_N3__": "012",
    "__LANGUAGE_A2__": "ar",
    "__LANGUAGES_A2__": [
        "ar",
        "fr"
    ],
    "address": {
        "input_layout": [
            "level1area",
            "postcode",
            "settlement",
            "street"
        ],
        "output_format": "{% if has_recipient %}{{ recipient_text }}\n{% endif %}{% if has_street %}{{ street_text }}\n{% endif %}{% if has_postcode or has_settlement %}{% if has_postcode %}{{ postcode_text }}{% if has_settlement %} {% endif %}{% endif %}{% if has_settlement %}{{ settlement_text }}{% endif %}\n{% endif %}{% if has_level1area %}{{ level1area_name }}\n{% endif %}{% if has_country %}{{ country_name }}\n{% endif %}",
        "level1area_names": {
            "en": "Province"
        },
        "level2area_names": null,
        "settlement_names": {
            "en": "Settlement"
        },
        "postcode_names": {
            "en": "Post Code"
        },
        "postcode_input_pattern": "[0-9]{5}",
        "postcode_input_example": "12345",
        "street_names": {
            "en": "House number, road"
        }
    },
    "phone": {
        "names": {
            "en": "Phone Number"
        },
        "prefixes": [
            "213"
        ],
        "input_pattern": "[0-9]+",
        "input_example": "####",
        "output_format": {
            "\\A.*\\Z": "\\1"
        }
    },
    "organization_id": null,
    "person_id": null,
    "iban": null
}