{
    "__COUNTRY_NAME__": "Belize",
    "__COUNTRY_A2__": "BZ",
    "__COUNTRY_A3__": "BLZ",
    "__COUNTRY_N3__": "084",
    "__LANGUAGE_A2__": "en",
    "__LANGUAGES_A2__": [
        "en"
    ],
    "address": {
        "input_layout": [
            "level1area",
            "settlement",
            "street"
        ],
        "output_format": "{% if has_recipient %}{{ recipient_text }}\n{% endif %}{% if has_street %}{{ street_text }}\n{% endif %}{% if has_settlement %}{{ settlement_text }}\n{% endif %}{% if has_level1area %}{{ level1area_name }}\n{% endif %}{% if has_country %}{{ country_name }}\n{% endif %}",
        "level1area_names": {
            "en": "District"
        },
        "level2area_names": null,
        "settlement_names": {
            "en": "Settlement"
        },
        "postcode_names": null,
        "postcode_input_pattern": null,
        "postcode_input_example": null,
        "street_names": {
            "en": "House number, road"
        }
    },
    "phone": {
        "names": {
            "en": "Phone Number"
        },
        "prefixes": [
            "501"
        ],
        "input_pattern": "[0-9]+",
        "input_example": "####",
        "output_format": {
            "\\A.*\\Z": "\\1"
        }
    },
    "organization_id": {
        "names": {
            "en": "Tax Identification Number "
        },
        "abbreviations": {
            "en": "TIN"
        },
        "input_pattern": "[0-9]{6}",
        "input_example": "123456",
        "output_format": {
            "\\A.*\\Z": "\\1"
        }
    },
    "person_id": null,
    "iban": null
}