{
    "__COUNTRY_NAME__": "India",
    "__COUNTRY_A2__": "IN",
    "__COUNTRY_A3__": "IND",
    "__COUNTRY_N3__": "356",
    "__LANGUAGE_A2__": "hi",
    "__LANGUAGES_A2__": [
        "hi",
        "en",
        "bn",
        "te",
        "mr",
        "ta",
        "ur",
        "gu",
        "kn",
        "ml",
        "or",
        "pa",
        "as",
        "mai",
        "ne",
        "sat",
        "ks",
        "kok",
        "sd",
        "sd-deva",
        "kha",
        "sa"
    ],
    "address": {
        "input_layout": [
            "level1area",
            "settlement",
            "postcode",
            "street"
        ],
        "output_format": "{% if has_recipient %}{{ recipient_text }}\n{% endif %}{% if has_street %}{{ street_text }}\n{% endif %}{% if has_settlement or has_postcode %}{% if has_settlement %}{{ settlement_text }}{% if has_postcode %} - {% endif %}{% endif %}{% if has_postcode %}{{ postcode_text }}{% endif %}\n{% endif %}{% if has_level1area %}{{ level1area_name }}\n{% endif %}{% if has_country %}{{ country_name }}\n{% endif %}",
        "level1area_names": {
            "en": "State / Territory"
        },
        "level2area_names": null,
        "settlement_names": {
            "en": "Settlement"
        },
        "postcode_names": {
            "en": "Post Code"
        },
        "postcode_input_pattern": "[0-9]{6}",
        "postcode_input_example": "123456",
        "street_names": {
            "en": "House number, road, district"
        }
    },
    "phone": {
        "names": {
            "en": "Phone Number"
        },
        "prefixes": [
            "91"
        ],
        "input_pattern": "[0-9]+",
        "input_example": "####",
        "output_format": {
            "\\A.*\\Z": "\\1"
        }
    },
    "organization_id": {
        "names": {
            "en": "Goods and Services Tax"
        },
        "abbreviations": {
            "en": "GSTIN"
        },
        "input_pattern": "[0-9]{15}",
        "input_example": "123456789012345",
        "output_format": {
            "\\A.*\\Z": "\\1"
        }
    },
    "person_id": null,
    "iban": null
}