{
    "__COUNTRY_NAME__": "Iceland",
    "__COUNTRY_A2__": "IS",
    "__COUNTRY_A3__": "ISL",
    "__COUNTRY_N3__": "352",
    "__LANGUAGE_A2__": "is",
    "__LANGUAGES_A2__": [
        "is"
    ],
    "address": {
        "input_layout": [
            "level1area",
            "level2area",
            "settlement",
            "postcode",
            "street"
        ],
        "output_format": "{% if has_recipient %}{{ recipient_text }}\n{% endif %}{% if has_street %}{{ street_text }}\n{% endif %}{% if has_postcode or has_settlement %}{% if has_postcode %}{{ postcode_text }}{% if has_settlement %} {% endif %}{% endif %}{% if has_settlement %}{{ settlement_text }}{% endif %}\n{% endif %}{% if has_level1area or has_level2area %}{% if has_level1area %}{{ level1area_name }}{% if has_level2area %}, {% endif %}{% endif %}{% if has_level2area %}{{ level2area_name }}{% endif %}\n{% endif %}{% if has_country %}{{ country_name }}\n{% endif %}",
        "level1area_names": {
            "en": "Region"
        },
        "level2area_names": {
            "en": "Municipality"
        },
        "settlement_names": {
            "en": "Settlement"
        },
        "postcode_names": {
            "en": "Post Code"
        },
        "postcode_input_pattern": "[0-9]{3}",
        "postcode_input_example": "123",
        "street_names": {
            "en": "Road, house number"
        }
    },
    "phone": {
        "names": {
            "en": "Phone Number"
        },
        "prefixes": [
            "354"
        ],
        "input_pattern": "[0-9]+",
        "input_example": "####",
        "output_format": {
            "\\A.*\\Z": "\\1"
        }
    },
    "organization_id": {
        "names": {
            "en": "Value Added Tax Number",
            "is": "Virðisaukaskattsnúmer"
        },
        "abbreviations": {
            "en": "VAT No.",
            "is": "VSK"
        },
        "input_pattern": "[0-9A-Z]{5,6}",
        "input_example": "A1B2C3",
        "output_format": {
            "\\A.*\\Z": "\\1"
        }
    },
    "person_id": null,
    "iban": {
        "names": {
            "en": "IBAN"
        },
        "input_pattern": "IS[0-9]{24}",
        "input_example": "IS123456789012345678901234",
        "output_format": {
            "\\A.*\\Z": "\\1"
        }
    }
}