{
    "__COUNTRY_NAME__": "Panama",
    "__COUNTRY_A2__": "PA",
    "__COUNTRY_A3__": "PAN",
    "__COUNTRY_N3__": "591",
    "__LANGUAGE_A2__": "es",
    "__LANGUAGES_A2__": [
        "es"
    ],
    "address": {
        "input_layout": [
            "level1area",
            "settlement",
            "postcode",
            "street"
        ],
        "output_format": "{% if has_recipient %}{{ recipient_text }}\n{% endif %}{% if has_street %}{{ street_text }}\n{% endif %}{% if has_postcode %}{{ postcode_text }}\n{% endif %}{% if has_settlement %}{{ settlement_text }}\n{% endif %}{% if has_level1area %}{{ level1area_name }}\n{% endif %}{% if has_country %}{{ country_name }}\n{% endif %}",
        "level1area_names": {
            "en": "Province"
        },
        "level2area_names": null,
        "settlement_names": {
            "en": "Settlement"
        },
        "postcode_names": {
            "en": "Post Code"
        },
        "postcode_input_pattern": "[0-9]{4}",
        "postcode_input_example": "1234",
        "street_names": {
            "en": "Road, house number, district"
        }
    },
    "phone": {
        "names": {
            "en": "Phone Number"
        },
        "prefixes": [
            "507"
        ],
        "input_pattern": "[0-9]+",
        "input_example": "####",
        "output_format": {
            "\\A.*\\Z": "\\1"
        }
    },
    "organization_id": {
        "names": {
            "en": "Single Registry of Taxpayers",
            "es": "Registro Unico de Contribuyentes"
        },
        "abbreviations": {
            "en": "SRT",
            "es": "RUC"
        },
        "input_pattern": "[0-9]{13}[A-Z]",
        "input_example": "1234567890123A",
        "output_format": {
            "\\A.*\\Z": "\\1"
        }
    },
    "person_id": null,
    "iban": null
}