{
    "__COUNTRY_NAME__": "Indonesia",
    "__COUNTRY_A2__": "ID",
    "__COUNTRY_A3__": "IDN",
    "__COUNTRY_N3__": "360",
    "__LANGUAGE_A2__": "id",
    "__LANGUAGES_A2__": [
        "id"
    ],
    "address": {
        "input_layout": [
            "level1area",
            "level2area",
            "settlement",
            "postcode",
            "street"
        ],
        "output_format": "{% if has_recipient %}{{ recipient_text }}\n{% endif %}{% if has_street %}{{ street_text }}\n{% endif %}{% if has_settlement or has_postcode %}{% if has_settlement %}{{ settlement_text }}{% if has_postcode %} {% endif %}{% endif %}{% if has_postcode %}{{ postcode_text }}{% endif %}\n{% endif %}{% if has_level1area or has_level2area %}{% if has_level1area %}{{ level1area_name }}{% if has_level2area %}, {% endif %}{% endif %}{% if has_level2area %}{{ level2area_name }}{% endif %}\n{% endif %}{% if has_country %}{{ country_name }}\n{% endif %}",
        "level1area_names": {
            "en": "Province"
        },
        "level2area_names": {
            "en": "Regency"
        },
        "settlement_names": {
            "en": "Settlement"
        },
        "postcode_names": {
            "en": "Post Code"
        },
        "postcode_input_pattern": "[0-9]{5}",
        "postcode_input_example": "12345",
        "street_names": {
            "en": "Road, house number, district"
        }
    },
    "phone": {
        "names": {
            "en": "Phone Number"
        },
        "prefixes": [
            "62"
        ],
        "input_pattern": "[0-9]+",
        "input_example": "####",
        "output_format": {
            "\\A.*\\Z": "\\1"
        }
    },
    "organization_id": {
        "names": {
            "en": "Tax ID Number",
            "id": "Nomor Pokok Wajib Pajak"
        },
        "abbreviations": {
            "en": "Tax ID",
            "id": "NPWP"
        },
        "input_pattern": "[0-9]{15}",
        "input_example": "123456789012345",
        "output_format": {
            "\\A.*\\Z": "\\1"
        }
    },
    "person_id": null,
    "iban": null
}