{
    "__COUNTRY_NAME__": "Latvia",
    "__COUNTRY_A2__": "LV",
    "__COUNTRY_A3__": "LVA",
    "__COUNTRY_N3__": "428",
    "__LANGUAGE_A2__": "lv",
    "__LANGUAGES_A2__": [
        "lv"
    ],
    "address": {
        "input_layout": [
            "level1area",
            "postcode",
            "settlement",
            "street"
        ],
        "output_format": "{% if has_recipient %}{{ recipient_text }}\n{% endif %}{% if has_street %}{{ street_text }}\n{% endif %}{% if has_settlement or has_postcode %}{% if has_settlement %}{{ settlement_text }}{% if has_postcode %}, {% endif %}{% endif %}{% if has_postcode %}{{ postcode_text }}{% endif %}\n{% endif %}{% if has_level1area %}{{ level1area_name }}{% endif %}{% if has_country %}{{ country_name }}\n{% endif %}",
        "level1area_names": {
            "en": "Municipality"
        },
        "level2area_names": null,
        "settlement_names": {
            "en": "Settlement"
        },
        "postcode_names": {
            "en": "Post Code"
        },
        "postcode_input_pattern": "LV-[0-9]{4}",
        "postcode_input_example": "LV-1234",
        "street_names": {
            "en": "Road, house number"
        }
    },
    "phone": {
        "names": {
            "en": "Phone Number"
        },
        "prefixes": [
            "371"
        ],
        "input_pattern": "[0-9]+",
        "input_example": "####",
        "output_format": {
            "\\A.*\\Z": "\\1"
        }
    },
    "organization_id": {
        "names": {
            "en": "VAT identification number",
            "lv": "Pievienotās vērtības nodokļa"
        },
        "abbreviations": {
            "en": "VATIN",
            "lv": "PVN"
        },
        "input_pattern": "[0-9]{11}",
        "input_example": "12345678901",
        "output_format": {
            "\\A.*\\Z": "\\1"
        }
    },
    "person_id": null,
    "iban": {
        "names": {
            "en": "IBAN"
        },
        "input_pattern": "LV[0-9]{2}[A-Z]{4}[0-9A-Za-z]{13}",
        "input_example": "LV12ABCDa1b2c3d4e5f6g",
        "output_format": {
            "\\A.*\\Z": "\\1"
        }
    }
}