{
    "__COUNTRY_NAME__": "Denmark",
    "__COUNTRY_A2__": "DK",
    "__COUNTRY_A3__": "DNK",
    "__COUNTRY_N3__": "208",
    "__LANGUAGE_A2__": "da",
    "__LANGUAGES_A2__": [
        "da",
        "de",
        "kl"
    ],
    "address": {
        "input_layout": [
            "level1area",
            "postcode",
            "settlement",
            "street"
        ],
        "output_format": "{% if has_recipient %}{{ recipient_text }}\n{% endif %}{% if has_street %}{{ street_text }}\n{% endif %}{% if has_postcode or has_settlement %}{% if has_postcode %}{{ postcode_text }}{% if has_settlement %} {% endif %}{% endif %}{% if has_settlement %}{{ settlement_text }}{% endif %}\n{% endif %}{% if has_level1area %}{{ level1area_name }}\n{% endif %}{% if has_country %}{{ country_name }}\n{% endif %}",
        "level1area_names": {
            "en": "Territory"
        },
        "level2area_names": null,
        "settlement_names": {
            "en": "Settlement"
        },
        "postcode_names": {
            "en": "Post Code"
        },
        "postcode_input_pattern": "[0-9]{4}",
        "postcode_input_example": "1234",
        "street_names": {
            "en": "Road, house number"
        }
    },
    "phone": {
        "names": {
            "en": "Phone Number"
        },
        "prefixes": [
            "45"
        ],
        "input_pattern": "[0-9]+",
        "input_example": "####",
        "output_format": {
            "\\A.*\\Z": "\\1"
        }
    },
    "organization_id": {
        "names": {
            "da": "Momsregistreringsnummer",
            "en": "VAT identification number"
        },
        "abbreviations": {
            "da": "CVR",
            "en": "VATIN"
        },
        "input_pattern": "DK[0-9]{8}",
        "input_example": "DK12345678",
        "output_format": {
            "\\A.*\\Z": "\\1"
        }
    },
    "person_id": null,
    "iban": {
        "names": {
            "en": "IBAN"
        },
        "input_pattern": "DK[0-9]{16}",
        "input_example": "DK1234567890123456",
        "output_format": {
            "\\A.*\\Z": "\\1"
        }
    }
}