{
    "__COUNTRY_NAME__": "Malta",
    "__COUNTRY_A2__": "MT",
    "__COUNTRY_A3__": "MLT",
    "__COUNTRY_N3__": "470",
    "__LANGUAGE_A2__": "mt",
    "__LANGUAGES_A2__": [
        "mt",
        "en"
    ],
    "address": {
        "input_layout": [
            "postcode",
            "level1area",
            "settlement",
            "street"
        ],
        "output_format": "{% if has_recipient %}{{ recipient_text }}\n{% endif %}{% if has_street %}{{ street_text }}\n{% endif %}{% if has_settlement %}{{ settlement_text }}\n{% endif %}{% if has_level1area %}{{ level1area_name }}\n{% endif %}{% if has_postcode %}{{ postcode_text }}\n{% endif %}{% if has_country %}{{ country_name }}\n{% endif %}",
        "level1area_names": {
            "en": "Region"
        },
        "level2area_names": null,
        "settlement_names": {
            "en": "Settlement"
        },
        "postcode_names": {
            "en": "Post Code"
        },
        "postcode_input_pattern": "[A-Z]{3} [0-9]{4}",
        "postcode_input_example": "ABC 1234",
        "street_names": {
            "en": "House number, road"
        }
    },
    "phone": {
        "names": {
            "en": "Phone Number"
        },
        "prefixes": [
            "356"
        ],
        "input_pattern": "[0-9]+",
        "input_example": "####",
        "output_format": {
            "\\A.*\\Z": "\\1"
        }
    },
    "organization_id": {
        "names": {
            "en": "VAT identification number",
            "mt": "Vat reg. no."
        },
        "abbreviations": {
            "en": "VATIN",
            "mt": "Vat No."
        },
        "input_pattern": "[0-9]{8}",
        "input_example": "12345678",
        "output_format": {
            "\\A.*\\Z": "\\1"
        }
    },
    "person_id": null,
    "iban": {
        "names": {
            "en": "IBAN"
        },
        "input_pattern": "MT[0-9]{2}[A-Z]{4}[0-9]{5}[0-9A-Za-z]{18}",
        "input_example": "MT12ABCD12345a1b2c3d4e5f6g7h8i9",
        "output_format": {
            "\\A.*\\Z": "\\1"
        }
    }
}