{
    "__COUNTRY_NAME__": "Honduras",
    "__COUNTRY_A2__": "HN",
    "__COUNTRY_A3__": "HND",
    "__COUNTRY_N3__": "340",
    "__LANGUAGE_A2__": "es",
    "__LANGUAGES_A2__": [
        "es"
    ],
    "address": {
        "input_layout": [
            "level1area",
            "postcode",
            "settlement",
            "street"
        ],
        "output_format": "{% if has_recipient %}{{ recipient_text }}\n{% endif %}{% if has_street %}{{ street_text }}\n{% endif %}{% if has_postcode or has_settlement %}{% if has_postcode %}{{ postcode_text }}{% if has_settlement %} {% endif %}{% endif %}{% if has_settlement %}{{ settlement_text }}{% endif %}\n{% endif %}{% if has_level1area %}{{ level1area_name }}\n{% endif %}{% if has_country %}{{ country_name }}\n{% endif %}",
        "level1area_names": {
            "en": "Department"
        },
        "level2area_names": null,
        "settlement_names": {
            "en": "Settlement"
        },
        "postcode_names": {
            "en": "Post Code"
        },
        "postcode_input_pattern": "[A-Z]{2}[0-9]{4}|[0-9]{5}",
        "postcode_input_example": "AB1234",
        "street_names": {
            "en": "Road, house number"
        }
    },
    "phone": {
        "names": {
            "en": "Phone Number"
        },
        "prefixes": [
            "504"
        ],
        "input_pattern": "[0-9]+",
        "input_example": "####",
        "output_format": {
            "\\A.*\\Z": "\\1"
        }
    },
    "organization_id": {
        "names": {
            "en": "National Tax Registry",
            "es": "Registro Tributario Nacional"
        },
        "abbreviations": {
            "en": "NTR",
            "es": "RTN"
        },
        "input_pattern": "[0-9]{14}",
        "input_example": "12345678901234",
        "output_format": {
            "\\A.*\\Z": "\\1"
        }
    },
    "person_id": null,
    "iban": null
}