{
    "__COUNTRY_NAME__": "Bulgaria",
    "__COUNTRY_A2__": "BG",
    "__COUNTRY_A3__": "BGR",
    "__COUNTRY_N3__": "100",
    "__LANGUAGE_A2__": "bg",
    "__LANGUAGES_A2__": [
        "bg"
    ],
    "address": {
        "input_layout": [
            "level1area",
            "settlement",
            "postcode",
            "street"
        ],
        "output_format": "{% if has_recipient %}{{ recipient_text }}\n{% endif %}{% if has_street %}{{ street_text }}\n{% endif %}{% if has_postcode or has_settlement %}{% if has_postcode %}{{ postcode_text }}{% if has_settlement %} {% endif %}{% endif %}{% if has_settlement %}{{ settlement_text }}{% endif %}\n{% endif %}{% if has_level1area %}{{ level1area_name }}\n{% endif %}{% if has_country %}{{ country_name }}\n{% endif %}",
        "level1area_names": {
            "bg": "Област",
            "en": "Province"
        },
        "level2area_names": null,
        "settlement_names": {
            "en": "Settlement"
        },
        "postcode_names": {
            "en": "Post Code"
        },
        "postcode_input_pattern": "[0-9]{4}",
        "postcode_input_example": "1234",
        "street_names": {
            "en": "Road, house number, district"
        }
    },
    "phone": {
        "names": {
            "en": "Phone Number"
        },
        "prefixes": [
            "359"
        ],
        "input_pattern": "[0-9]+",
        "input_example": "####",
        "output_format": {
            "\\A.*\\Z": "\\1"
        }
    },
    "organization_id": {
        "names": {
            "bg": "Идентификационен номер по ДДС",
            "en": "VAT identification number"
        },
        "abbreviations": {
            "bg": "ДДС номер",
            "en": "VATIN"
        },
        "input_pattern": "BG[0-9]{9,10}",
        "input_example": "BG123456789",
        "output_format": {
            "\\A.*\\Z": "\\1"
        }
    },
    "person_id": null,
    "iban": {
        "names": {
            "en": "IBAN"
        },
        "input_pattern": "BG[0-9]{2}[A-Z]{4}[0-9]{6}[0-9A-Za-z]{8}",
        "input_example": "BG12ABCD123456a1b2c3d4",
        "output_format": {
            "\\A.*\\Z": "\\1"
        }
    }
}